{
  "case_id": "case-0030",
  "created_at": "2026-02-21T01:07:56.685Z",
  "age_months": 36,
  "locale": "en-US",
  "caregiver_text": "Limited eye contact, repetitive play.",
  "images": [
    "thumbnails/thumb_030.svg"
  ],
  "embedding_b64": "ujHgPTsZxL2YhHO9o5ZcvQF5pz27fM09rqsGvcFrtr12N+q6V3HgPTBGrj1SUx+9uggFvV/fv71Th4g7Aq4SvENesr3gydA9uRA8uxR7b7wjEdw9XfENvY5QcD0dCgs978SlPdFhhj3AEeC9JtF1PQw8hz2sfTk9PWCHOmH+Ub2/fqW8E7jgPfwSeD1QVq49BQWQPfJ1XL13p+C7CKdkvTQ4J70s34W9o/IRvZ+vsr1Mvqs8+AvUu0kWsL10n5y9iT/DvcgVbD0eKWo95C2ove6VEr3rj7g9keaSvVR/M71vk4s99KhOvMXoCT3rR0E9lDTjO5SVAbwGcG09hjqMPWWIGTuNxyS9bU6nPBuaCjxYksE9u/JuPZZEkL0ioZK7Dwt3uxGlsT2wGYc9H/ikPGETYT1B3X69aQZZvOSYujwn+xY9RlEdPTquqT1dIWq9kEOXvbr48buIi7w8GA1CvQvhqz28Gw49tUSuvc4vYL2JnwI978P1PNPOqL0Ob4i9tUGzvak4Zb1ATlo9fEXgPQtulb3lexW9Zi8TPQdxjD2YctK91GiQPXn3wz3s3EY9esCAu4/MPrxpi4A8XHU3PWbJ6zwR+w293R/MvCovrzvPFBC9m16eO6rsRz33B4u9p9eEPSX/3rwGQ4o8mY4XvUgZtLy42lY9ijIYPdO9tz25k6m9e5R7vYIoJb1+mpQ8xXS6vZIH7Lzm0kw9nfqsPbu/1b09CQO91mfYPfPemj1oX9c9VBNxvUsQjDyfLMS93murPYUCkb0SeQu7hpHCvcZztj0QTc+9LIpYPaAi9LvPbsI8FeAmPReNhD2x1aW97WVoOzecAbzxP7O9yEHYulumJT0+1Aq9k+9FO/RMqL3AxRy7pOWuPXSzzj1tQqc9YWzWvMkV2z1LYA+9ekcNPDqNE7xa0L49TMYkvETPvzp9f7u9y5MGvSb/yjwT2dS9YvVPvfrhlz0CH3S9ov/LvVWhir3B/1E9fnD4vBQ9qbxAix89+9GdvT60b71I7ak8rTgBu4+D3L3DPva8shl2PJ/LNL2WerG90cZiveGqpz0jA1i9DiFuvedrBr3Q0As9i+OVvD3+hL35Ha+9NSIJPfAWub0PZcM9hFC7vWiWpLrNl6U9q0/OvVvLyrwLjJo6ziK1PXxjdj02Fta9Eu2fvP3iXr0d9Cw9s2qlPTk4c701okc4PLPMPG9z0z1mkaQ8Fw7WvHC4eLxSj7u7xIbQPD0qmD0QfMs9UHakvT1V0j3DqU09LsqEve8XZL3GCru9kR6TuxtUJD0fC909+e+KPThrMj2XGi69SLpgvdMZuL3UYaw9iXGQPJJY0z3p8Yg90JpGvMH9zb2XpYM9jlKFvQ==",
  "emb_version": "medsiglip-v1",
  "mock_inference": {
    "summary": [
      "Mock summary for case-0030."
    ],
    "risk": "on_track",
    "recommendations": [
      "Short play-based activities",
      "Rescreen in 3 months"
    ],
    "parent_text": "Try daily language play; re-check in 3 months.",
    "explainability": [
      {
        "type": "text",
        "detail": "No two-word phrases",
        "score": 0.7027822249915969
      }
    ],
    "confidence": 0.66,
    "adapter_id": "mock/adapter_v1",
    "model_id": "mock/medgemma"
  },
  "audit_log": [
    {
      "timestamp": "2026-02-21T00:07:56.685Z",
      "actor_type": "model",
      "actor_id": "mock/medgemma",
      "action": "inference",
      "reason": "",
      "model_version": "mock-v1",
      "adapter_id": "mock/adapter_v1"
    }
  ]
}