{
  "case_id": "case-0036",
  "created_at": "2026-02-21T01:07:56.688Z",
  "age_months": 48,
  "locale": "en-US",
  "caregiver_text": "Runs and climbs well, still wobbly on one foot.",
  "images": [
    "thumbnails/thumb_036.svg"
  ],
  "embedding_b64": "pgppPehH1j1RTO48emVyPbrnJ7zY5cW9AsZZPO6ZU73fjIg6SeYoPfoETD2zHQY9zvfMu0tZtj2ML5u9RUHVPb+QSb0tVjg9UK15PQtyDT3mf2a9YOOou3yzwD0ZfVK9CLGfvf2Jz7xEajQ9Ig0NPfobTD3RPpW8sHb9vHFS471gcye9dgRdvTjG7jy0Rlq8iESZPTHVXD1GBPa7fk58PWKhab0UwZS9Yjtyva21wb1srNu9+KPAvErZ47wF2SI98t+qPZKDET2BwaS9LfE5vTfSnL0XJbU8HDKpPUq81b3LeyA9nNI9vXaanz0U59W9RDkmvUL5Cr2gEny7YHkgvKUUjb2LybS9iHyDPRKliL1ZvUg9m/+3vd9BXz3G2yW85FDQPXCtkT0Kg6g9m4AevXSmzz19ubw88+y1vJeIlr28n2y99n6pPWzqu714yWa9s6v9O/fwkjwQ+uQ8jIAXPbJ2nD2+fRw9kX2LvcVLwb1nKG09BwDdvaL4mb2TQpY94hWXuwF7xz1DfdC92XhAvYV6xj0SBY68X+ZfPbSuYL1UDok8XmCqPTcfJj1fEwu9Wwo0Pc3ulj2+D7m93os2PcmXWD2bcNG88JaSuxJEbb1+0Mi9iT7WvYxiqb1JmbE8dtQRPXxzDT1HQ8S9I9AFvfh7Mj24WY09ouWJO9bqlryTCa87QcDUPIDWWjwhATs90eRkvYnVcbwZJRQ9AJrOPUzj47pGFB+9s0XiPfnivz1xXsg8Ow2APfCkAb1UJbS8gryBPR/Ss72+4DC81nuYvdIk2j3Em149NI4CPSVSkL2aSP48VduYvSx0oj2HqkQ9vW0RPe4nLT2wZ1o8JMmIPdSPtb2jtpo81grCvCWdfT2P+qA8nV1pvVisgLxTj+A9ZzrNPVENCjsqMPI82LcUvXmQX71M+9289QS5PViZzb2d08i9IbBUPWcn2rsmVK+9tQPOvd2uqD0J3ac7TQHRvD6UbLw81Y09ALDjPTZXpDyLnWc9IdTRvFSvoLz299+9SaUWvfB2obwpn289H/6EPSFzgzy8Rys8md2ePW8+1D0IN728paGHPX5AdDyaHYK7LNOmPcL1Gz15CJC9Fl+xPdlL/rzjpJ29uYBOvf4K6jwN9/u8tp2IvYshj72Jk4s9aPfDvLaxKr3Bw7U9Yn3QvSrZuTxevTm8e655vSgYX71CupO8PK/IPVulXbz3k3M6EDPPvdGgwj0qiQg9RSG8PcHTjL1TYbo9fOWtvYMVPz3y32m9rUu+vWtQk72wKyu8ENGaPPzZXz064s29eRZWPTOn2D0mmsa9YTONPYXhkr0cFNs8b4mYvGLU4r3gaMq9d/pLvIkWgr3s81C9lGqMPQ==",
  "emb_version": "medsiglip-v1",
  "mock_inference": {
    "summary": [
      "Mock summary for case-0036."
    ],
    "risk": "on_track",
    "recommendations": [
      "Short play-based activities",
      "Rescreen in 3 months"
    ],
    "parent_text": "Try daily language play; re-check in 3 months.",
    "explainability": [
      {
        "type": "text",
        "detail": "No two-word phrases",
        "score": 0.7758023885910739
      }
    ],
    "confidence": 0.9,
    "adapter_id": "mock/adapter_v1",
    "model_id": "mock/medgemma"
  },
  "audit_log": []
}