{
  "case_id": "case-0044",
  "created_at": "2026-02-21T01:07:56.691Z",
  "age_months": 0,
  "locale": "en-US",
  "caregiver_text": "Limited eye contact, repetitive play.",
  "images": [
    "thumbnails/thumb_044.svg"
  ],
  "embedding_b64": "hwVPPRlPwzw1Hfo8zMPEveHSY72ZJM69iPKivR8Rz70BPX293KCCu8crkz0zt+W8oCeQuyxBuj2KhRk91fqnPaaIjjq99c69qN92vZDXWT0F/iC8T0nUvau1a73105y9W1iiPCgiE70SCSw9RVajvczTPzwb7oW9MaXWuke0HL0wXLA8AbndPWIShz19Z6G9kfGBPHPwrDzYEYy9VEaPvcxgzrsC7Mg9roTPPGTfJ70OzMw9JeUXPTY4mD3exsq9Tjq3Pa5KvL0x1wW9DmCGPXsdoDsxTnK8k5vKPWmrvz2LPS+9cwR9PdAcRb1aRsE6nRS5PSBSOT1wnEA8myqTPeKLoj3jQIS8IrXePDwC3j0wBC09evOGPQ6pWjxEGJG9XsdtPFC9Gr0e5QS9WGrZvdnpgL2ECwi9931BPIECYr0oqYU9XRvxvOxekL04poK9THuCPQhbnbwL7VU8sTEAPFV/jj3WZLa9GyzHvY/ZSj0FlLW9T9OZPTK1dT0rTGS9qRNjO2B4Mr24QNM9ndVBvZzZvLzyFaK9UxJ7vMRfaD1BsfM8rnaMPTawtD0q+d29WO4ovTF00j3OUp09kJmMvepdcz09kbU9yM3EvMw00z3hZB693bqUPfXbCD0v7Y29G1aQPfZBajwnj9w843KpPV9Sir3o4dI9juTFPRl0MD2Uvdg92EVmPMBnLr0aJgK820WlPM0CGDub31s9Qw7CvYStTz1Za9q7PrIKPc7GyD0pzgm9NgqOPRV0pT2p9B49K1XCvQedxj3xzC+8JzScvfbTrT0HDKS8OFYnOqDRgr0N0LG9yjI7PeTziD2G0Ry9bxzRPDUENL28m1k9xxmtO2Dqkz297dW9XJqPvTuuqL1Oh3k9f19JvTKbsz0fNtM9wsQGPGpzdj1AsKU9ME9JvDe7Hb1K45C7f6uFPcnTn72OD809xy+bvUoWu736gAo9zlsvvdl9xztxdEE9fGccvQV/BLnhPx49FqNRvK77Qr2CYrs9VXDTvSdkrLp5w/a7RMcavJw11jzRyum8kdavPXZOdb08knQ9a3ToPH6AyL0a0MK9vvWzvf1vE73HKeg8/RsGPM+Rtj00BWC9IWWEvczMhbxg7Nq9hSzHPH25170LtVk9eKsCPFYCQTwN4Rg9kmXPvM1ZIr3PpZa9FH2DPemXlT3LQTe9BSB5PZr5272vYdo9mveSvUd1kT2Ds2u9gIhIvdTW5bxSRCK9U272PHnIwr0hy4e81xLcPOSTmb3ByYG9A5SMPcJyX73vbuW8KWrHPYcBoL2wDHe9i8F3vbwR3LwbvpU8fOIGPHEhILxSkY29UaPAPWebGj1P1MG9IbcyvZQqrb0A5gc9EV/6PA==",
  "emb_version": "medsiglip-v1",
  "mock_inference": {
    "summary": [
      "Mock summary for case-0044."
    ],
    "risk": "monitor",
    "recommendations": [
      "Short play-based activities",
      "Rescreen in 3 months"
    ],
    "parent_text": "Try daily language play; re-check in 3 months.",
    "explainability": [
      {
        "type": "text",
        "detail": "No two-word phrases",
        "score": 0.7173891470856795
      }
    ],
    "confidence": 0.63,
    "adapter_id": "mock/adapter_v1",
    "model_id": "mock/medgemma"
  },
  "audit_log": []
}