{
  "case_id": "case-0046",
  "created_at": "2026-02-21T01:07:56.692Z",
  "age_months": 24,
  "locale": "en-US",
  "caregiver_text": "Limited eye contact, repetitive play.",
  "images": [
    "thumbnails/thumb_046.svg"
  ],
  "embedding_b64": "1y4uvQlSrDzra6C9ladLPJD6vT3u6cg8TKj3vFzgcL0l5e28fQ19vRHBfzwNxmU9uJ6kvTC4DDzSx6i9T3QxPLyGlz0MJlS8HrVovVOAVj1tkRI9I64tvfOFuL0/qHA96/uiPROloL1Fq3C92aWaPQ2Ypz1I5IQ8RdefPfAeH7yPPSk9swYKPb4Cir1/Abg9wYkbuii8P73sihC8mA4xveyz170p3iM8ZY+UvU1GgTtFGDg8opvHPW+exbwiFEe9pHzGvaYjqDzdlj69Z7kavbSIkr1Bt7Q85wuivKwFyb3vuHa9tf6YvIHPTL3Za7+9UKinvdZDwT0IhrO9ad6fvcwrLr0ksWI99WeQPc13STzSJIo8uUk+uk/5HL15wBU941fCPV0/xj2bbJK8wFKUPc5C7bs9m3a9j9lTvO9Kmb2CwaM9oLGxvdrEaL3daKY9kHf4u4OgljyvesS4qv8BvBUs3bw6vrw9+iumOxSlpL1UB3I9O4jSvdFQb73JuTg9Z7YPPUS/tL0dRBI9+45QPaQJgz2MF0W9/PvqPFAmx7z/q7m9fJD9O0FrY7qYUce9SlrSvUxzMb0i61g9bGiVPbGhljwX8nE9NGakPVmAo701lx29GgXDvd0TDD2SvaU8w+QhvUKO2z0Y7oq9KfmGOwiynz23ji096ukLPYehdLxKJF49gUXHvWu71r00soQ9s2REPSBn1j23R9S91i+xvXfOqz0/NYK9ejxZvR+bq720Ntq9mjhJve7maD1W7dg9wzWYPWgZxr3//jc7xltNvf+Zbbyz2J09uQYrvbl0tz3+fEC9jAW/vRX5q7wZ9FY9lhOePcfLiD19c6W9ED+4vcdCKb0/4Es9tvy2vXQjo71z59q8GRSgvQ3jlr3lsLO7S9AsPWWcMr122XM8WSVyvcTkxL0gQLq8b5a0PL9UiL0YgRC8pACqPePcVr0Qziq91sOQPd3L5ruadtK9k22HvOyECL11Eai94UXGvflbXrv3wGW9swucPa6Imr0AT447Vw8OvYOfwTxLQoM9GdGDPWT6iztjtd48zoRwPRG9HD1GvQS96pLsPG/gKDvTrZO9QRrOPVj92L3plsy9IEhTPQIayj0K/yg7HJaWPVlAPL3joLe9RzyfPWQDcD0Djq696KbRPU+qr70dSwk9n0eIveaMSb0yQrw9a/G/PKVfyL1JdQ29ssmOPdPtjTwF+FA9nUXcPG8fc709L8s9caOOvLlp1T140iY97oNePOsKOD1S/Jc95DLXPWu2lbqSRRe9lHnTvaApIL3vIWU9ITaTPFoAFL1HitC9+Ot7vQVa171jPFG95uU9O0DqLTyXOeo8ReuPvGt/vT2AGRi9Z7+JPQ==",
  "emb_version": "medsiglip-v1",
  "mock_inference": {
    "summary": [
      "Mock summary for case-0046."
    ],
    "risk": "on_track",
    "recommendations": [
      "Short play-based activities",
      "Rescreen in 3 months"
    ],
    "parent_text": "Try daily language play; re-check in 3 months.",
    "explainability": [
      {
        "type": "text",
        "detail": "No two-word phrases",
        "score": 0.8663241039713448
      }
    ],
    "confidence": 0.75,
    "adapter_id": "mock/adapter_v1",
    "model_id": "mock/medgemma"
  },
  "audit_log": []
}