{
  "case_id": "case-0050",
  "created_at": "2026-02-21T01:07:56.694Z",
  "age_months": 18,
  "locale": "en-US",
  "caregiver_text": "Plays alongside others, minimal sharing.",
  "images": [
    "thumbnails/thumb_050.svg"
  ],
  "embedding_b64": "kMqfPaJD57vMHtC9edqUPRVTlj2ySeK8Ju3MvfgnOzwQH7o9RL1TPaXgjj3Vv4O9vO/aPNH0zb0Hqra8bu6lvVahnLvE5n6948KnOIA0zb0oKNE9uKcZvZfBELwQ+4i8CMPFPZJtDDzbGaE9DKMiPQ2kkz1hb/c7dx0VveTftL36tLY8fkSVvGj7jzxcVyO92bmxvatFez2n97g9TWliPc2HtL0pvYQ9z6whvMH06zsFibE8KbmhPbjZeL217iG99+vHPYuHnr0acJo9a6U3PaY03Dyu5Mm9Df58vS1Xmj2FZow9ilvRvXagxjzOqpi8TiqFPCM5X72qKRK9WRtbPUUZmr2SQnS9j9GSvRWUQzyoBc69cH7vvOkRuj1vX/67Fx2vvXfTyz1uNdI90y+IvB0XUT31sSO9sa29vdV0iD3yq9M9vMGkvVqjPzwng8y96SmJOf56xr389c29DWOgPVQWZD0i/q24RKuRPdt//7slfWe9fzw6vdKGKTyGVNS9VQffvJfkuz0rKcy9vmY+Pbx0Fr3HqLQ9a+aHPQ+0hb08rJU9ygDsPBcfkr1BgdA9opQivXv+oT2lqyK8MCkpPVrcNr2xh2692orwuwt1vz3PMi49LgHGPVzjkjyRn5i8tbyCvWWqxb0NVcy9hfSnvYqtbrz/qYq9mAmrvUGhUb2T8BI9xxxgvZ8On7zVopg8dL8UPewAf73ewq68BAGyPT6X0LwwbmA7IuHIPU9ZWr25cpO89G0BPTijHD2KDAY9E201vR9vKj03SJ09aCyoPDWvuD12yzw9u6xhvBH1QrwjVYc9pabAvEx9gb3zWLa8pe3KvSFHEr2OQqO9nwoFvbXezz2qMlO97kTOvRhubb1lrjY9YsfcvNBesb0T7bw9TTE/PUS7y73wjzy9IBSqPVzyaL1x23I9gEtCvQ1lgD0/zn08YhxLO9eW17tUjm487uugvfj5tj3/xk89RcObvSiVxboiBom9Vx4vvQrmy72raVK9gEyRPY26sD1ERrw9a/RrPbzNVD22UD69xqlsPapNmb18Yja91J1uPehHaTyKl0M8fdKvPV62cb2Arra9XRqLPT1ob7seEb88sI2cPeBn7DuWg8A9SXR6PBebLL2OTTQ8fLPfPNgW6Ty/tbC8AOzTPF4S2TzTDSm9JOi7vcTKa71OM7i9lMqZvWQW0T0NH/w80CfzPBm/Az3cC7C9MMeBvbLcLr3+szC93XTEvUA2wD278L+9P25mPcpOsrz6q529tfjnvE2VDz0ZfnK95tYLPUmUwL0YRlU9BGRGPdd+7jxY6T+8sKCrPfyiGD0uEiK9Fue7PXH617zIkdI9MrqxPMmUrj3ISoe9jQqXPQ==",
  "emb_version": "medsiglip-v1",
  "mock_inference": {
    "summary": [
      "Mock summary for case-0050."
    ],
    "risk": "refer",
    "recommendations": [
      "Short play-based activities",
      "Rescreen in 3 months"
    ],
    "parent_text": "Try daily language play; re-check in 3 months.",
    "explainability": [
      {
        "type": "text",
        "detail": "No two-word phrases",
        "score": 0.83769838330918
      }
    ],
    "confidence": 0.91,
    "adapter_id": "mock/adapter_v1",
    "model_id": "mock/medgemma"
  },
  "audit_log": [
    {
      "timestamp": "2026-02-21T00:07:56.694Z",
      "actor_type": "model",
      "actor_id": "mock/medgemma",
      "action": "inference",
      "reason": "",
      "model_version": "mock-v1",
      "adapter_id": "mock/adapter_v1"
    }
  ]
}