{
  "case_id": "case-0035",
  "created_at": "2026-02-21T01:07:56.687Z",
  "age_months": 36,
  "locale": "en-US",
  "caregiver_text": "Points to things, seems social.",
  "images": [
    "thumbnails/thumb_035.svg"
  ],
  "embedding_b64": "NfgMPXbNLr2ZsD28CbFdPWPKm72tY1g9h1mePDRkPL0oZ4K9vHZWOv8Htr38Ldg9wUjjvBqUxT2JkZY91FmBvZaC4Lwr2LI8d1y+PRdStT1zH3w9IvTHPAzr1D3UtQK9aG7ou7FASz1qoqs9SUaNPasjKzx/iti8qFqwvXSoob3lqcc8QruGPabkkD0to4w8B9IjvYUiyj2YZKm8A/qwvbohjr1Rs469N1mlPcXVKr3Hgh69VL8fvfHgtb0y0ge95H3ZPeIlBb0dRJG931hxPTO5Wz3hx9o9UROFORHbgj2TYke9IO/VPaXW0D1cicO98Kaqva9+zj3r14k9n6noPDIodD2tx8e9lBLIvO45Wr19E8i6A0LOPektiL3ovtq9ai/QPSgygT3/fb+9hPzWvMH8G72hJra9dlqbPf72oztIXe+8R41ZvcQeID3HwIO9vc7avZqwHz17B8w9WZjWPW1n3LzQ/qc9ODmcPJiJP73g1Uc9N4PCvbYVczyaSYw9ozYUPfuHiz3ZTds9T6TKveOapT3wXIm9pipSPQ+YRLxgERU91sNePdgs0L1M0oo9gQGivY8G0L3REaC8988cPVCvC72QyMm9F9bbvQ15ADwUF9a9zNr9PMejPb24SP08445zvfKK3LzW/Yq9zthBPYaMDryD5Xa9eCWlvKo4Abx3B6O88+FdPe0agbyNQTC95LDBPV6xwT3tELG9S2y+vUVRYT1gT1k9tZhQvfEwQzzXwDs8cv6qvdYc3zsPwoE9/sqCPYSBYT2XlkC9ikSfPXyNH7w1/0K8j7gOPShO9rwzrz08y8r+O+KN5jspnUu9EmLRvaKywj2T1m471Ce0vaY6GD27y5C9y1I3vcSAuTt+VJa95ejDvaJjlr2OC7Y7adiNPThSorxn3Eu9LXyEPJaoBD2Fv8Y9IgccvfJPlT3nYEO9qCK8vNWUjj0mpqa8+FsHPVv1gbzJ5I+8amhZvRlspDw0Uqy9PgJ8vDx2zT1Ioeg8lSS9PSc3c72QNgW8I37YPdzcqD3totG84k1nu/+v0zvaJ6a95WW+vW9DyDwJSa09o/wRvPRH3LtF3Zy8EeDaPMyr6zyATYm97wYyvQ8SYj2yoLG9CUSKvTCKzr0iObe9/QhXvDr63rvUWIU9+DiNPAYgCb3/w+W8RkBtvKQviz0CFvy8vIavvSAjTr2gq8g9yYNvPaHDbr0wYro9RxfbPaNFvb2aIpG9U60/PX8+dr3AoZq6vFwSvJI2lD2Z69E7tNSnvcLve7wCYHi9XLyzPcPNrj3Rk5m8+pU6PdyJiT1iPH89FnifvfjrIT03UfI8sWKOvUfwEbx1dqY99nn6vAnptr3lT8O8wXqWPQ==",
  "emb_version": "medsiglip-v1",
  "mock_inference": {
    "summary": [
      "Mock summary for case-0035."
    ],
    "risk": "monitor",
    "recommendations": [
      "Short play-based activities",
      "Rescreen in 3 months"
    ],
    "parent_text": "Try daily language play; re-check in 3 months.",
    "explainability": [
      {
        "type": "text",
        "detail": "No two-word phrases",
        "score": 0.8300987142468987
      }
    ],
    "confidence": 0.83,
    "adapter_id": "mock/adapter_v1",
    "model_id": "mock/medgemma"
  },
  "audit_log": [
    {
      "timestamp": "2026-02-21T00:07:56.687Z",
      "actor_type": "model",
      "actor_id": "mock/medgemma",
      "action": "inference",
      "reason": "",
      "model_version": "mock-v1",
      "adapter_id": "mock/adapter_v1"
    }
  ]
}