{
  "case_id": "case-0041",
  "created_at": "2026-02-21T01:07:56.690Z",
  "age_months": 48,
  "locale": "en-US",
  "caregiver_text": "Parent concerned about speech.",
  "images": [
    "thumbnails/thumb_041.svg"
  ],
  "embedding_b64": "thmQvZMcortXBKi952UYPUKWzzxZ2qa99OlEvSPFzDtXQr09A7VGvTAADr3GuZs7rvnCPROxrT0tkl0775hRvbkyKD0w2t28KJ4ivR9ey71XNK89+GPTvA+hrDw70NO99Tmuu92ZoLw8CSo9GsBgPAPtwb1UwOW7zMG3u1mNnrtjcGO8Qq6uOzJ5HbzNL7i9ROpGvSXdxL3Kjso9FGabvcyMsLxq8dM9YYu8PJSMSzspqaO9bxaQPS+hxTxhWTo9goaEPWqkLr1Vl/W8bBuzvVQ1fLw5sW49LQ6Vu2Ocrz1DR4M8g17xu3SCCT0M2SM9ApCsO1euHT289pq9igTdvcW58Dy5MBU9goXIPVKCBz1NnK28k7W3vD7mMj0rx468AlPQPR3zxb1LuMG7qZNLvVpqqzzf4qW9fDShvac7VT3q/6s9sAZXvap/1z2KZ9c9W6fzu7CmlL1u6Mg8w5ZkPaFZiT2B4rm9Ym14vYdRjLyuTyK89ZzAPX2/fr1XBtC8jGzfPBCY0D2CGZy9iZpNu/YnOruk5LG7Af3MPeiivrhYeaQ9uCC+PXckl737CoW92cnqPONu171StJC9DCKGvdqSoTyObKY9Gb3vvKdO9byRnt09MtKCPLOdxT0RdFa9RoCxvV91hT3/xgM9Pdh1vXdIR714x4o9VwG1vYNZ7TwF1lM9GnhOvaa3gDzqc8097W0yPQmPxr1+fL89t8EsPUi7ArwHcUI9Ehm8vR6OvD1c/w894NCgPN2Dpj1aAzO9na2VvVUgnbvS4b49zoI3vawmqbwfGpY66EW6PU21Bb14Gtw9C2aQvUNJsD1dVpk7ADjSPd7puz01jz+75wwfvdFEFb2wtRQ7mhw1PRmZEzxKnlW948jPvZYFQz1y18y9dfkdPVqJPz1NCbK8W+n5PEi5rT0qO489GubzvGFRMr3VYt+9pbGmPOhv3T3vopE8Wn5vPTIGyj2YJVO9u0ZTvfyFoz11dJy9S8M2vYzHDL34eki8FdGpvJvyKL2tJZe9JnOyvWoAvL0vGIa9O9XYPJwmJL1POMQ9+vCSPfB4jj1fo4u9eBnMPcW+mD1noEq91XSRvF5a0bw1bnc9ssDtvHvdWz3Q+f48yO8/PfILw7wsjAw8JRexPdeq2z1ow9I9z52MvbSoRj1XBx+9mxzIvR4LlL2SQZW9+AcvvXlow73HUsC9o9bFPZ5nA71I44I7edSSPYqZrj1dnN09+UG6vPkJDD0RZ269bg+zPN83Y7y6HX09oDKovb4To7x+QCi9UUwbvUeVwz1z74o9fPfCvfjjoz0k2j09O/8gvZhCXjstKLE92lvXvZTEfj2YAyA8OEuPvXxZiD3jc3u9PYAcvQ==",
  "emb_version": "medsiglip-v1",
  "mock_inference": {
    "summary": [
      "Mock summary for case-0041."
    ],
    "risk": "monitor",
    "recommendations": [
      "Short play-based activities",
      "Rescreen in 3 months"
    ],
    "parent_text": "Try daily language play; re-check in 3 months.",
    "explainability": [
      {
        "type": "text",
        "detail": "No two-word phrases",
        "score": 0.754831386961949
      }
    ],
    "confidence": 0.78,
    "adapter_id": "mock/adapter_v1",
    "model_id": "mock/medgemma"
  },
  "audit_log": []
}