{
  "case_id": "case-0027",
  "created_at": "2026-02-21T01:07:56.684Z",
  "age_months": 18,
  "locale": "en-US",
  "caregiver_text": "Uses spoon, sometimes fork; spills often.",
  "images": [
    "thumbnails/thumb_027.svg"
  ],
  "embedding_b64": "A5u0veJo3z2zPLi9THzJPd1hm714XNK9BaWbvXKgr7288co8KT00PQy3Er3dVsg9E2+yPWi/2D0LwIG9fW79PCO3Yj2avgA9UGtbvKK6BT0JpTW9MYGTvUTAEb2GhLU9jQvVPXr27bxhnF897tfRvV4Z2T2PxDO935wWvbCcnT20Wh69dUyOuz2gtr1ciNG8Ve7ePUxwgT1N+qC9rFYkPY7vtr3Gt/G89/iFPWmgrrwngxg9UzxtPf8FOr2b8Z48iQZ3PXA79byHBbC9ONPQPS39O71pCXM8GeeZPDH2Bz3bCB694FK4PXEqPD3X54+8avcAvUoVXb3jAy066PTZO4Z+pryK6zK9U2pOPWUrbb0wD9Q9952IPSOvKjxaKLc97F/CPPzR2T0M4OC9XpLHPeK/zzrJZuM9ghdAPTBC0r1Lix29EoCEPI4n3j3YYDK9/axzPYFyVDpTUO881+t7PJWVPr21Gaw6+zmLvGur2byVj5m8lW1DPL+omD2p2Dm7GUSiPGN/vz0UzAC9KX6EvUfklD0MG4k83pGcvcDVjzxeLaS8kgRuPNITpbvkEww86QSrO2MWhD3Vum28arTFPZdS3b2lNhK821SRvVOncjx7oYE8BR6/PLU4yD1a6o+9PuWPPFpSozsy2EG9/d7BvHQkAr0tfpA9EemTvaxaoT3OnGy8AG+ePXs0H71iEwk7qwCvvf0qAD26iNC9kKdCveUXxj0nbJq9f4WmvBc+V73g3WE9SriEvUFhaz2xKks9Yq2nPRtAir1y49I9EokQvZLE6jtYnT68iuOsPJgLKr3r2N68/RrLPW31vrtFUzo7FXOIPRB3g73mr9o8WnGOvH9Pnj3TBpK9pOCIvZckxL0sMeI9ia+8PVBtmjrBA3u7ROvmO5kDjj1EFcU97rFpPGuWh7xRfT66A/HSvenm370UiDu9FLQJvfJti7xHVzk90umDOln3h72leiA9i0EkPeX+hL1O+fu8klviPPb92L3GXM29hIiiO6ScWbzz1Yo9e4MVPTu/jL3rYFe9eY2QPaRW3L1xNoG7j4RWvB5qm72rceG7UdqqPfrlnr3X8bY9Q62EPB1OoLx0mKY8BV/LvbZ12r3kFjA9ItikvZyekz0QAtu9BhlGveARizxD8q09GKcqO6/wlb2Xw3m9ZQtAPIPg0j2GE6+9GjZJPVe1Mr26ANC9ke2ePYJ2eL2GVi49wKSXvZhSkL2OQA88WP6PPfkH2j3/7ca8HfwuPTwYj73GZbm9mBOOPQOP5L1kngw7TqjBO2Blhr3GoLc9tkMFvVf1djzVmAk9R6BEPcd7AD0HduG95DiVPfsZtL0tHok8P1o6vVL4nb0H98q9dIVbvQ==",
  "emb_version": "medsiglip-v1",
  "mock_inference": {
    "summary": [
      "Mock summary for case-0027."
    ],
    "risk": "monitor",
    "recommendations": [
      "Short play-based activities",
      "Rescreen in 3 months"
    ],
    "parent_text": "Try daily language play; re-check in 3 months.",
    "explainability": [
      {
        "type": "text",
        "detail": "No two-word phrases",
        "score": 0.7724203652749422
      }
    ],
    "confidence": 0.93,
    "adapter_id": "mock/adapter_v1",
    "model_id": "mock/medgemma"
  },
  "audit_log": []
}