{
  "case_id": "case-0043",
  "created_at": "2026-02-21T01:07:56.691Z",
  "age_months": 48,
  "locale": "en-US",
  "caregiver_text": "Points to things, seems social.",
  "images": [
    "thumbnails/thumb_043.svg"
  ],
  "embedding_b64": "0300vP8zn73bENK7OBrvvGtSpT1brQQ9aUnGPVVfcL1nu4C9laN0PVIhnT1gb4q95APTvVLDv7wEd5I9j7cnvBeWjr3xDjQ9D+btumObzT3FWXk9Evs3va7Syb34KFQ9GG1rvZkGuz37JJS8AGOTvQYzxzxv+J09wTqCvJUHxL2NK5Y9unxOvQ72aL2ADFu9y3krvclRrr0bcZa93XKBPZGznT1oe4e97gxkPJkFsj1kBXC97le4vWR+Wj3ih8G9tgFoPYK6vDusrLm9hAA/vRl+A73B6/w8lTWqPR5mTb2Lsya8jj9nvNEph737RBO9CDUKvcKv4zx0KaC9HzRPPdRlJT01PXA9kQY/vU3msT2KJvM8Iy/Zvff/vjx/W9E8FelsPYKVGr2xKgK9UvpfPFLXnzzj2BI9pfurvUG/lz0jTpG8bRs4PUKJ8bz09rs9mLtsPbR/uz34EXK9BBg4vbNkpD2Nwb+9qMyJvSRiC71oexE7tQJ0Pc7epL0XkxG9qU2zvObyy70V5M89JB8svL9rjjwVFrC9dtOZvfArUz2Cu2y8p9rTvNgcMD3wwHQ925vTPXsYOb3Swqi9FdMcPTjhP73XEU+71qCyPRd9xT2Tdwy9Fb+dPV6YLz3k9u28sMeKPcqIJb18NbI9ApiGvWnHnD2bbbQ9DibIvRBFMT0EKKc73daNvbolXDzPSx+8q1KZvfORnjwI6Ru9WFNyPY6DiL0E0bW9dZEBvYl4iT3P3pm9lYJkPfwvjD3rXZO9J4v1vKGHrb0nfo290kakPTWeh71LOG+9ikzXvZ0LEb1RdGk9yJHqPKlCvr1hV829NX6WPeREPz1E0cM9BW9UPQ/WNr0xUMm967/VvZLHob20lpi9sjyWvZB25LzFV4k9NkJXvUiqbD2x87o8Q9OJOjZFgD3vWGu8ZLawvcl+1j1xuY+9UqI6u4ssFbtIICC9AXbTPRclgjxY8CQ6OPTXvZqVj70nXo28ZXwcvGt+tLyDKtM8ZGzOvUVutTx2RM09Tg6fPOBnyj1PuEy9LWpTPfuZDj0XfP+84PiiPSXqfL10m4M9pzgEPR9CLz1Hm789NhYlPZQHzL3Z/os9gvAdvT5cLr1H0OG8ykSNvfGKhj2sOJ69xvaXPexQvT2jMok9TrkKvaKslT3rmDc8j1w1vYfUrT06WWi9HFWOPDFTuz1hmrg9mpevvXFIfz1fA669trSyPCFVEjx0cJC9/PqlPViJh7yrhjA98a7DvcaA0L015pW9vbErPSE7yr37uE+9vfjMveqmiD37yrG64nUKvRuqcb3ySgw9IgqFvR3VBrxqase8JgnDvIWLgbqVcxo9LO+gvR4akz04aTc9dvKQPA==",
  "emb_version": "medsiglip-v1",
  "mock_inference": {
    "summary": [
      "Mock summary for case-0043."
    ],
    "risk": "monitor",
    "recommendations": [
      "Short play-based activities",
      "Rescreen in 3 months"
    ],
    "parent_text": "Try daily language play; re-check in 3 months.",
    "explainability": [
      {
        "type": "text",
        "detail": "No two-word phrases",
        "score": 0.7770613139746962
      }
    ],
    "confidence": 0.57,
    "adapter_id": "mock/adapter_v1",
    "model_id": "mock/medgemma"
  },
  "audit_log": []
}