{
  "case_id": "case-0033",
  "created_at": "2026-02-21T01:07:56.686Z",
  "age_months": 24,
  "locale": "en-US",
  "caregiver_text": "Uses spoon, sometimes fork; spills often.",
  "images": [
    "thumbnails/thumb_033.svg"
  ],
  "embedding_b64": "Mf+lPeSfjT0xcp69prO9u+qNIz0p+VA9DoGSvG7HjT1WirS9OXXYvallrr2MVXK9HUfZPZQThbydXMG9fbyZvcY0Hz1t1zW8d6WyvVFWxruJnVK8x5a/PbN2q73kTyC9l58TvSini7wlRQ696qw+vVgxYDxvrai9wDzBvZCWUb2HFc+9ivI3vKtIpD0Axgo9IdaTPbeNHb1R4tC9ZqzHvUI4yjylwGA8IZsOvV3gvr2KxpQ9wwntPBZK+rxWZ9e8/By1u+hFsr3yH7a91E0JvHkwqDwEJog9FypFPeDgEzwpZyM9n0YOvXj/2T2RtU+9qo9hvX77sr0BadK95j+yO5zrc73uBki9dgyePNV6pj3KvcA9qy4LPS3Ur7weI7A9AbyzvSeokr2gxsA9efZyPfTR2L2lHaU92tuqPTQbebzoDqE9OKljPUCqLTtIKng8iuyUvfYA0Lw9W548jF+iPRO9pL3oz2g8QJCIPZEc3D0+VyY9Vt+TPW0Djr1nVoy8OskWu7UnoD350hO9OSOxvfXUST0J0yA9my8IvRI/ab1eSqW99YhhvTQJcT06Dzw9CCTRvIw6tjywpHK99W2uPAgZ+TzmhoG90b1wvWp+RTzTcdW819+hu7ruc7yQLPI8hTOnveSqEz1Fg4A8YOsXvR1epL3GWz69mJBLPU8zVT3je3m9BrmKvK5D4jsgLVk9D3I2u3vux71gHiE8enOPvZvLM7qRHVG8LYxuvHGplb1FzgQ9mWYWParSnTtqqaQ93tqJPRynYrsnStg9tyKSve8fnj0rX229mnBQvWzdnT3uy6s9h4e4vZt4gr1szMe9zAdJPbca/zz0fY08E9YwPZSZkL2byZU9RSpEvQ7XnT3poB8830LBPbamBT2ao7y8FgAkvVF7o7xu/tm9YC6bveuGIzxkEoi9mS/MvfD7qL1aKcI90r9nPYceHzuMA869Cz6LPRqVuTz4m2I9e0LYPQCAyL1hD9A9T4/OvWrU2j2R28E9TjOPPWmxlbulmM49O/XiPGfXoTwtyJU99ZDbvTpDjT2ZYEU73gSevBSMUL2o8iY9PC7/uhbpXrwkZYG8Lh3BvfaJ3rzE8BO9JXZNvae4mL3WMW67chnEvH141r0I3x69ofV8Pfm4Br2D4Nm9X+WZu5o8zD0Ifg080a2yPfIGQr0D4Ek9fs+JPV+UHj1n2hW9jtSNvdLEqb21lFi9F6wVvJhSET0ODDy81hqMvS0wtL1/xhK9I+jUPdI2JD1JfpO9z6bRPYvyzD0FhDs9eMVjvOBW2b0rvAw9Uz9sPSZP1jzmx5W8evDLveC81z08Nu28nj67vInQ173846c9V77QuZ7y4Lx218W9H6WWPA==",
  "emb_version": "medsiglip-v1",
  "mock_inference": {
    "summary": [
      "Mock summary for case-0033."
    ],
    "risk": "on_track",
    "recommendations": [
      "Short play-based activities",
      "Rescreen in 3 months"
    ],
    "parent_text": "Try daily language play; re-check in 3 months.",
    "explainability": [
      {
        "type": "text",
        "detail": "No two-word phrases",
        "score": 0.6805207264759275
      }
    ],
    "confidence": 0.94,
    "adapter_id": "mock/adapter_v1",
    "model_id": "mock/medgemma"
  },
  "audit_log": []
}