{
  "case_id": "case-0040",
  "created_at": "2026-02-21T01:07:56.689Z",
  "age_months": 36,
  "locale": "en-US",
  "caregiver_text": "Uses spoon, sometimes fork; spills often.",
  "images": [
    "thumbnails/thumb_040.svg"
  ],
  "embedding_b64": "uXbovPsFpj2dAJQ98jWcvT/Txr1kn4E9eZCkPZN9or1RrhU8qrwOPfbJp71x8ye9wYaqu1w6Cj2F0na9VJsTveYmFb20c5C8Z9+OvXT3pz2+Dpk9LLU+vfLOJL0LdD29AzZpPFQT1L0/68K9rOCgPekDlL2wKJm9rcCKvbrOND1Dwag8FT58vckzLb2Hea29b1OovWx+q7vMIMI9UsGzvSNyij2HINa9nIiBvQvRWL2u6+08s9QRPcrh2TwecKo9NHnovK8oPLyXlao9IKGvPUTsm73fyA69fjYDPXMMLj241Su9sDy0vAKuLj3aAvy8m51tvfgS0D1K0rc9UYgRvUeYRr01WoI9ng4PvbAHEr1Zw9Y9zGDbPHdhv722UHS99u/JPSQXoz0q4p48WA9EvESacz2pRRc9OB68PR9TiT2j8C49Y71APD01Lb2y4s09+rGnvB8Osr3Yp1G9DoeKPRxkr73aimS7tOIyPb5JCbvcmDu9v5ALvehFYj2FmrM9fiGIPXQHxrzpCnG8t12KPXwSzj098Mk9h9SrPBsGqb3KMI09UZPLO7xpor1WSji92bfSvOHfSj2lWSY95bUUPetRGz2Bq1s9uXtIPZz0Kr262Tw7WmdevTHRBz3mb9y8wmurPRACwj3FQvm829IsvHJorT3TJqE9ZbfRvJ7DDL3UZkM96VStPVjas71Ek729NQd7O1eqWT028/Y86R9hvRSr7DuWDNK9F2TPPV2knr0I+I49wompvdwvpb1Z2FI8YvvZvN8+aD20imK8VlS4PcAqtD1RRpc8FJrcO0Csd73tuvs8S1+avJ0jg72uv5W8uhHBPIJjkj2AebC9pddwvUKlRry/oVe7o9DFvdJsU73Japa8uX8VvdX21L14DUy9qTGkPH0FwT3Hsqy9C3L/ui+Zsr2+TkY9tI6cPQ++hDxmBmg6fTqhvUFphrxZYI27RNSbPYmfxrzHlc69zxCsvY8Asj3Loom950TDPTZJ+bzOa1a9h8PQvQKaPLzPrIk8Qol0vTN2mT3Efcs9tXYivRn8z72YlJ09amHJPITR1r2+uMk9ShI0vd6fnL2D+LE90woKvXcMGzwgLis9GhGqPbJ2f72YLh88TS4KPXvcx70gRVu9FF2IvQS/sj220169lzmfPM69u7xnjJS974PJvUKzoT3XKqc9XveRvetsgTxkUcO9nanTuWz5nj0MmEa9yC+UPRf/+Dyke7U9c/xxvYJ5d7xksNG9I3KHPNfcrz1ed3m9WBHNPc4E1buDWkU97SIVPajviz2lsX091fVTPQfchr0sEU+996a5vGenuDw8NRo9MdO0vY4hn72+QL29wl0vvVLmkb32tg67sW++PQ==",
  "emb_version": "medsiglip-v1",
  "mock_inference": {
    "summary": [
      "Mock summary for case-0040."
    ],
    "risk": "refer",
    "recommendations": [
      "Short play-based activities",
      "Rescreen in 3 months"
    ],
    "parent_text": "Try daily language play; re-check in 3 months.",
    "explainability": [
      {
        "type": "text",
        "detail": "No two-word phrases",
        "score": 0.6224735910975094
      }
    ],
    "confidence": 0.55,
    "adapter_id": "mock/adapter_v1",
    "model_id": "mock/medgemma"
  },
  "audit_log": [
    {
      "timestamp": "2026-02-21T00:07:56.689Z",
      "actor_type": "model",
      "actor_id": "mock/medgemma",
      "action": "inference",
      "reason": "",
      "model_version": "mock-v1",
      "adapter_id": "mock/adapter_v1"
    }
  ]
}